### ISSUE TITLE
phoronix-test-suite upload-result returns Unhandled Exception -> HTTP/1.1 500 Internal Server Error

### ISSUE THREAD

**Issue by T-X** [phoronix-test-suite/phoronix-test-suite#810]
When trying to upload results on Debian Sid with a Lenovo T14s AMD Gen3 I'm getting the following error:

```
$ phoronix-test-suite upload-result lenovo-thinkpad-t14s-gen3-amd-ptsunigine1920x1200-fancontrol-gpuvram8gb-2024-08-282

    [PROBLEM] Unhandled Exception 

Results Failed To Upload.
```

In Wireshark I can see this seems to be due to a "HTTP/1.1 500 Internal Server" from 2606:4700:3035::6815:1e02 (cloudflare?):

```
Frame 14155: 790 bytes on wire (6320 bits), 790 bytes captured (6320 bits) on interface wlp1s0, id 0
Ethernet II, Src: de:ad:ca:fe:aa:aa (de:ad:ca:fe:aa:aa), Dst: xxx (xxx)
Internet Protocol Version 6, Src: 2606:4700:3035::6815:1e02, Dst: xxx
    0110 .... = Version: 6
    .... 0000 0000 .... .... .... .... .... = Traffic Class: 0x00 (DSCP: CS0, ECN: Not-ECT)
    .... 1111 0111 0110 1001 1011 = Flow Label: 0xf769b
    Payload Length: 736
    Next Header: TCP (6)
    Hop Limit: 56
    Source Address: 2606:4700:3035::6815:1e02
    Destination Address: xxx
Transmission Control Protocol, Src Port: 80, Dst Port: 57912, Seq: 1, Ack: 12927, Len: 704
Hypertext Transfer Protocol, has 1 chunk (including last chunk)
    HTTP/1.1 500 Internal Server Error\r\n
        [Expert Info (Chat/Sequence): HTTP/1.1 500 Internal Server Error\r\n]
        Response Version: HTTP/1.1
        Status Code: 500
        [Status Code Description: Internal Server Error]
        Response Phrase: Internal Server Error
    Date: Sun, 08 Sep 2024 02:54:30 GMT\r\n
    Content-Type: text/html; charset=UTF-8\r\n
    Transfer-Encoding: chunked\r\n
    Connection: close\r\n
    Cache-Control: no-cache, must-revalidate\r\n
    Pragma: no-cache\r\n
    Vary: User-Agent\r\n
    CF-Cache-Status: DYNAMIC\r\n
     [truncated]Report-To: {"endpoints":[{"url":"https:\/\/a.nel.cloudflare.com\/report\/v4?s=aEJlzU5V23mBm6wNx%2Fsxn2raLjj9%2FHMieQT3aIlV5%2FMyCve69xhz2rJPBuOUYJoeqEy7TjMQqBHU5BhD4FvOfZEEHalz%2BZty4dG4N5zIhofsGIOIdjQAsOZzFCaJyRP0olVQtYRoGhLGE
    NEL: {"success_fraction":0,"report_to":"cf-nel","max_age":604800}\r\n
    Server: cloudflare\r\n
    CF-RAY: 8bfba780eebd716e-DUS\r\n
    alt-svc: h3=":443"; ma=86400\r\n
    \r\n
    [HTTP response 1/1]
    [Time since request: 0.457645665 seconds]
    [Request in frame: 13388]
    [Request URI: http://openbenchmarking.org/f/client.php]
    HTTP chunked response
        End of chunked encoding
        \r\n
    File Data: 0 bytes
```

The request was the following:

```
Frame 13388: 880 bytes on wire (7040 bits), 880 bytes captured (7040 bits) on interface wlp1s0, id 0
Ethernet II, Src: xxx (xxx), Dst: de:ad:ca:fe:aa:aa (de:ad:ca:fe:aa:aa)
Internet Protocol Version 6, Src: xxx, Dst: 2606:4700:3035::6815:1e02
    0110 .... = Version: 6
    .... 0000 0000 .... .... .... .... .... = Traffic Class: 0x00 (DSCP: CS0, ECN: Not-ECT)
    .... 0000 0011 1101 1110 1101 = Flow Label: 0x03ded
    Payload Length: 826
    Next Header: TCP (6)
    Hop Limit: 64
    Source Address: xxx
    Destination Address: 2606:4700:3035::6815:1e02
Transmission Control Protocol, Src Port: 57912, Dst Port: 80, Seq: 12133, Ack: 1, Len: 794
[10 Reassembled TCP Segments (12926 bytes): #13367(1348), #13368(1348), #13369(1348), #13370(1348), #13376(1348), #13377(1348), #13378(1348), #13379(1348), #13387(1348), #13388(794)]
Hypertext Transfer Protocol
    POST /f/client.php HTTP/1.1\r\n
        [Expert Info (Chat/Sequence): POST /f/client.php HTTP/1.1\r\n]
        Request Method: POST
        Request URI: /f/client.php
        Request Version: HTTP/1.1
    Host: openbenchmarking.org\r\n
    Connection: close\r\n
    User-Agent: PhoronixTestSuite/Nesseby\r\n
    Content-Length: 12737\r\n
        [Content length: 12737]
    Content-Type: application/x-www-form-urlencoded\r\n
    \r\n
    [Full request URI: http://openbenchmarking.org/f/client.php]
    [HTTP request 1/1]
    [Response in frame: 14155]
    File Data: 12737 bytes
HTML Form URL Encoded: application/x-www-form-urlencoded
    Form item: "r" = "upload_test_result"
    Form item: "client_version" = "10840"
    Form item: "gsid" = "CKKZUO389"
    Form item: "gsid_e" = "KUIVKUIEIE19"
     [truncated]Form item: "composite_xml" = "PD94bWwgdmVyc2lvbj0iMS4wIj8+CjwhLS1QaG9yb25peCBUZXN0IFN1aXRlIHYxMC44LjQtLT4KPFBob3Jvbml4VGVzdFN1aXRlPgogIDxHZW5lcmF0ZWQ+CiAgICA8VGl0bGU+TGVub3ZvIFRoaW5rcGFkIFQxNHMgR2VuMyBBTUQgcHRzL3VuaWdpbmUvMTkyM
    Form item: "composite_xml_hash" = "4580874c4ad4dc32ebe18c0a991c69081f01dcca"
    Form item: "local_file_name" = "lenovo-thinkpad-t14s-gen3-amd-ptsunigine1920x1200-fancontrol-gpuvram8gb-2024-08-282"
    Form item: "display_status" = "1"
    Form item: "user_name" = "tux"
    Form item: "communication_id" = "LVKIXPTOOMGZJMKNVW"
    Form item: "sav" = "LELJ"
```
